tweet_id	timestamp	source	text	expanded_urls	rating_numerator	rating_denominator	name	gender	dog_stage	year	month	date	day	time
799757965289017345	2016-11-18 23:35:32	iPhone	This is Sobe She's a h*ckin happy doggo Only one leg tho Must have good balance 13/10 would smile back https://tco/OiH8PaOxB1	https://twitter.com/dog_rates/status/799757965289017345/photo/1,https://twitter.com/dog_rates/status/799757965289017345/photo/1,https://twitter.com/dog_rates/status/799757965289017345/photo/1,https://twitter.com/dog_rates/status/799757965289017345/photo/1	13.0	10	Sobe	female	doggo	2016	November	11-18	Friday	23:35
799422933579902976	2016-11-18 01:24:14	iPhone	This is Longfellow (prolly sophisticated) He's a North Appalachian Oatzenjammer Concerned about wrinkled feets 12/10 would hug softly https://tco/bpLuQuxzHZ	https://twitter.com/dog_rates/status/799422933579902976/photo/1	12.0	10	Longfellow	male		2016	November	11-18	Friday	01:24
799297110730567681	2016-11-17 17:04:16	iPhone	This is Jeffrey He's quite the jokester Takes it too far sometimes Still 11/10 would pet https://tco/YDtZcAiMAf	https://twitter.com/dog_rates/status/799297110730567681/photo/1,https://twitter.com/dog_rates/status/799297110730567681/photo/1	11.0	10	Jeffrey	male		2016	November	11-17	Thursday	17:04
799063482566066176	2016-11-17 01:35:54	iPhone	This is Mister He only wears the most fashionable af headwear 11/10 h*ckin stylish https://tco/BXJFKOVnJm	https://twitter.com/dog_rates/status/799063482566066176/photo/1,https://twitter.com/dog_rates/status/799063482566066176/photo/1,https://twitter.com/dog_rates/status/799063482566066176/photo/1,https://twitter.com/dog_rates/status/799063482566066176/photo/1	11.0	10	Mister	male		2016	November	11-17	Thursday	01:35
798933969379225600	2016-11-16 17:01:16	iPhone	This is Iroh He's in a predicament 12/10 someone help him https://tco/KJAKO2kXsL	https://twitter.com/dog_rates/status/798933969379225600/photo/1,https://twitter.com/dog_rates/status/798933969379225600/photo/1	12.0	10	Iroh	male		2016	November	11-16	Wednesday	17:01
798925684722855936	2016-11-16 16:28:21	iPhone	This is Shadow He's a firm believer that they're all good dogs H*ckin passionate about it too 11/10 I stand with Shadow https://tco/8yvpacwBcu	https://twitter.com/dog_rates/status/798925684722855936/photo/1	11.0	10	Shadow	male		2016	November	11-16	Wednesday	16:28
798209839306514432	2016-11-14 17:03:50	iPhone	This is Cooper His bow tie was too heavy for the front so he moved it to the side Balanced af now 13/10 https://tco/jG1PAFkB81	https://twitter.com/dog_rates/status/798209839306514432/photo/1	13.0	10	Cooper	male		2016	November	11-14	Monday	17:03
797971864723324932	2016-11-14 01:18:12	iPhone	Here's a helicopter pupper He takes off at random H*ckin hard to control 12/10 rare af https://tco/GRWPgNKt2z	https://twitter.com/dog_rates/status/797971864723324932/photo/1,https://twitter.com/dog_rates/status/797971864723324932/photo/1	12.0	10		male	pupper	2016	November	11-14	Monday	01:18
797545162159308800	2016-11-12 21:02:38	iPhone	This is Cassie She steals things Guilt increases slightly each time 12/10 would forgive almost immediately https://tco/Ia19irLwyB	https://twitter.com/dog_rates/status/797545162159308800/photo/1,https://twitter.com/dog_rates/status/797545162159308800/photo/1,https://twitter.com/dog_rates/status/797545162159308800/photo/1,https://twitter.com/dog_rates/status/797545162159308800/photo/1	12.0	10	Cassie	female		2016	November	11-12	Saturday	21:02
797236660651966464	2016-11-12 00:36:46	iPhone	This is Pancake She loves Batman and winks like a h*ckin champ 12/10 real crowd pleaser https://tco/6kqsAjJNhi	https://twitter.com/dog_rates/status/797236660651966464/photo/1,https://twitter.com/dog_rates/status/797236660651966464/photo/1	12.0	10	Pancake	female		2016	November	11-12	Saturday	00:36
796865951799083009	2016-11-11 00:03:42	iPhone	This is Tyr He's just checking on you Nifty af tongue slip 12/10 would absolutely pet https://tco/Jgnuiyvq06	https://twitter.com/dog_rates/status/796865951799083009/photo/1	12.0	10	Tyr	male		2016	November	11-11	Friday	00:03
796759840936919040	2016-11-10 17:02:03	iPhone	Say hello to Romeo He was just told that it's too cold for the pool H*ckin nonsense 11/10 would help fill up https://tco/6hx7ur6sNI	https://twitter.com/dog_rates/status/796759840936919040/photo/1,https://twitter.com/dog_rates/status/796759840936919040/photo/1	11.0	10	Romeo	male		2016	November	11-10	Thursday	17:02
796484825502875648	2016-11-09 22:49:15	iPhone	Here's a sleepy doggo that requested some assistance 12/10 would carry everywhere https://tco/bvkkqOjNDV	https://twitter.com/dog_rates/status/796484825502875648/photo/1	12.0	10		none	doggo	2016	November	11-09	Wednesday	22:49
796387464403357696	2016-11-09 16:22:22	iPhone	This is Snicku He's having trouble reading because he's a dog Glasses only helped a little Nap preferred 12/10 would snug well https://tco/cVLUasbKA5	https://twitter.com/dog_rates/status/796387464403357696/photo/1,https://twitter.com/dog_rates/status/796387464403357696/photo/1	12.0	10	Snicku	male		2016	November	11-09	Wednesday	16:22
796149749086875649	2016-11-09 00:37:46	iPhone	This is Ruby She just turned on the news Officially terrified 11/10 deep breaths Ruby https://tco/y5KarNXWXt	https://twitter.com/dog_rates/status/796149749086875649/photo/1,https://twitter.com/dog_rates/status/796149749086875649/photo/1	11.0	10	Ruby	female		2016	November	11-09	Wednesday	00:37
796125600683540480	2016-11-08 23:01:49	iPhone	"#ImWithThor 13/10
https://tco/a18mzkhTf6"	https://twitter.com/king5seattle/status/796123679771897856	13.0	10		none		2016	November	11-08	Tuesday	23:01
796116448414461957	2016-11-08 22:25:27	iPhone	I didn't believe it at first but now I can see that voter fraud is a serious h*ckin issue 11/10 https://tco/7i0bDMbrVN	https://twitter.com/dog_rates/status/796116448414461957/photo/1	11.0	10		none		2016	November	11-08	Tuesday	22:25
796080075804475393	2016-11-08 20:00:55	iPhone	This is Yogi He's 98% floof Snuggable af 12/10 https://tco/opoXKxmfFm	https://twitter.com/dog_rates/status/796080075804475393/photo/1	12.0	10	Yogi	male		2016	November	11-08	Tuesday	20:00
796031486298386433	2016-11-08 16:47:50	iPhone	This is Daisy She's here to make your day better 13/10 mission h*ckin successful https://tco/PbgvuD0qIL	https://twitter.com/dog_rates/status/796031486298386433/photo/1	13.0	10	Daisy	female		2016	November	11-08	Tuesday	16:47
795464331001561088	2016-11-07 03:14:10	iPhone	Elder doggo does a splash Both 13/10 incredible stuff https://tco/gBUDjdEcqz	https://twitter.com/dog_rates/status/795464331001561088/video/1	13.0	10		none	doggo	2016	November	11-07	Monday	03:14
795400264262053889	2016-11-06 22:59:35	iPhone	This is Brody He's trying to make the same face as the football 12/10 https://tco/2H4MfOGlpQ	https://twitter.com/dog_rates/status/795400264262053889/photo/1,https://twitter.com/dog_rates/status/795400264262053889/photo/1,https://twitter.com/dog_rates/status/795400264262053889/photo/1,https://twitter.com/dog_rates/status/795400264262053889/photo/1	12.0	10	Brody	male		2016	November	11-06	Sunday	22:59
795076730285391872	2016-11-06 01:33:58	iPhone	This is Bailey She loves going down slides but is very bad at it Still 11/10 https://tco/ivPWhspN3E	https://twitter.com/dog_rates/status/795076730285391872/photo/1,https://twitter.com/dog_rates/status/795076730285391872/photo/1,https://twitter.com/dog_rates/status/795076730285391872/photo/1	11.0	10	Bailey	female		2016	November	11-06	Sunday	01:33
794926597468000259	2016-11-05 15:37:24	iPhone	This is Mack He's rather h*ckin sleepy Exceptional ears 12/10 would boop https://tco/XRPvTPF0VH	https://twitter.com/dog_rates/status/794926597468000259/photo/1	12.0	10	Mack	male		2016	November	11-05	Saturday	15:37
794332329137291264	2016-11-04 00:15:59	iPhone	This is Nimbus (like the cloud) He just bought this fancy af duck raincoat Only protects one ear tho 12/10 so h*ckin floofy https://tco/SIQbb8c3AU	https://twitter.com/dog_rates/status/794332329137291264/photo/1	12.0	10	Nimbus	male		2016	November	11-04	Friday	00:15
794205286408003585	2016-11-03 15:51:10	iPhone	This is Laika She was a space pupper The first space pupper actually Orbited earth like a h*ckin boss 14/10 hero af https://tco/trSjgY3h4g	https://twitter.com/dog_rates/status/794205286408003585/photo/1,https://twitter.com/dog_rates/status/794205286408003585/photo/1,https://twitter.com/dog_rates/status/794205286408003585/photo/1	14.0	10	Laika	female	pupper	2016	November	11-03	Thursday	15:51
793962221541933056	2016-11-02 23:45:19	iPhone	This is Maximus His face is stuck like that Tragic really Great tongue tho 12/10 would pet firmly https://tco/xIfrsMNLBR	https://twitter.com/dog_rates/status/793962221541933056/photo/1,https://twitter.com/dog_rates/status/793962221541933056/photo/1	12.0	10	Maximus	male		2016	November	11-02	Wednesday	23:45
793845145112371200	2016-11-02 16:00:06	iPhone	This is Clark He was just caught wearing pants 13/10 game-changing af https://tco/2Xo19aPrG5	https://twitter.com/dog_rates/status/793845145112371200/photo/1	13.0	10	Clark	male		2016	November	11-02	Wednesday	16:00
793601777308463104	2016-11-01 23:53:02	iPhone	This is Dobby I can't stop looking at her feet 12/10 would absolutely snug https://tco/LhzPWv6rTv	https://twitter.com/dog_rates/status/793601777308463104/photo/1	12.0	10	Dobby	female		2016	November	11-01	Tuesday	23:53
793500921481273345	2016-11-01 17:12:16	iPhone	This is Fiona She's an extremely mediocre copilot Very distracting Wink makes up for all the missed turns 12/10 https://tco/aF5MmpvPqN	https://twitter.com/dog_rates/status/793500921481273345/photo/1,https://twitter.com/dog_rates/status/793500921481273345/photo/1	12.0	10	Fiona	female		2016	November	11-01	Tuesday	17:12
793286476301799424	2016-11-01 03:00:09	iPhone	This is Moreton He's the Good Boy Who Lived 13/10 magical as h*ck https://tco/rLHGx3VAF3	https://twitter.com/dog_rates/status/793286476301799424/photo/1,https://twitter.com/dog_rates/status/793286476301799424/photo/1	13.0	10	Moreton	male		2016	November	11-01	Tuesday	03:00
793271401113350145	2016-11-01 02:00:14	iPhone	Meet Dave It's his favorite day of the year He gets to fulfill his dream of being a dinosaur 12/10 inspirational af https://tco/MgQSdfZGPN	https://twitter.com/dog_rates/status/793271401113350145/photo/1	12.0	10	Dave	male		2016	November	11-01	Tuesday	02:00
793256262322548741	2016-11-01 01:00:05	iPhone	Oh h*ck look at this spookling right here Fright level off the charts 12/10 sufficiently spooked https://tco/BNy9IIJMb0	https://twitter.com/dog_rates/status/793256262322548741/photo/1	12.0	10		none		2016	November	11-01	Tuesday	01:00
793241302385262592	2016-11-01 00:00:38	iPhone	This is Tucker He's out here bustin h*ckin ghosts 13/10 dedicated af https://tco/Ap477GhwXt	https://twitter.com/dog_rates/status/793241302385262592/photo/1	13.0	10	Tucker	male		2016	November	11-01	Tuesday	00:00
793226087023144960	2016-10-31 23:00:11	iPhone	This is Juno She spooked me up real good but only to get my attention Above average handwriting for a dog I think 11/10 https://tco/hFxxBCWlwj	https://twitter.com/dog_rates/status/793226087023144960/photo/1,https://twitter.com/dog_rates/status/793226087023144960/photo/1,https://twitter.com/dog_rates/status/793226087023144960/photo/1	11.0	10	Juno	female		2016	October	10-31	Monday	23:00
793210959003287553	2016-10-31 22:00:04	iPhone	This is Maude She's the h*ckin happiest wasp you've ever seen 10/10 would pet with caution https://tco/etL8FHBrh8	https://twitter.com/dog_rates/status/793210959003287553/photo/1	10.0	10	Maude	female		2016	October	10-31	Monday	22:00
793195938047070209	2016-10-31 21:00:23	iPhone	Say hello to Lily She's pupset that her costume doesn't fit as well as last year 12/10 poor puppo https://tco/YSi6K1firY	https://twitter.com/dog_rates/status/793195938047070209/photo/1,https://twitter.com/dog_rates/status/793195938047070209/photo/1	12.0	10	Lily	female	puppo	2016	October	10-31	Monday	21:00
793180763617361921	2016-10-31 20:00:05	iPhone	This is Newt He's a strawberry 11/10 https://tco/2VhmlwxA1Q	https://twitter.com/dog_rates/status/793180763617361921/photo/1	11.0	10	Newt	male		2016	October	10-31	Monday	20:00
793165685325201412	2016-10-31 19:00:10	iPhone	This is Benji He's Air Bud It's a low effort costume but he pulls it off rather h*ckin well 12/10 would happily get dunked on https://tco/IbzT7DJvBo	https://twitter.com/dog_rates/status/793165685325201412/photo/1	12.0	10	Benji	male		2016	October	10-31	Monday	19:00
793150605191548928	2016-10-31 18:00:14	iPhone	This is Nida She's a free elf Waited so long for this day 11/10 https://tco/3lE8Izgmkf	https://twitter.com/dog_rates/status/793150605191548928/photo/1	11.0	10	Nida	female		2016	October	10-31	Monday	18:00
793135492858580992	2016-10-31 17:00:11	iPhone	Your favorite squad is looking extra h*ckin spooky today 13/10 for all https://tco/PrgvOyPtDT	https://twitter.com/dog_rates/status/793135492858580992/photo/1,https://twitter.com/dog_rates/status/793135492858580992/photo/1	13.0	10		none		2016	October	10-31	Monday	17:00
793120401413079041	2016-10-31 16:00:13	iPhone	This is Robin She's desperately trying to do me a frighten but her tongue drastically decreases her spook value Still 11/10 great effort https://tco/sxMrsOZ8zb	https://twitter.com/dog_rates/status/793120401413079041/photo/1	11.0	10	Robin	female		2016	October	10-31	Monday	16:00
792913359805018113	2016-10-31 02:17:31	iPhone	Here is a perfect example of someone who has their priorities in order 13/10 for both owner and Forrest https://tco/LRyMrU7Wfq	https://twitter.com/dog_rates/status/792913359805018113/photo/1,https://twitter.com/dog_rates/status/792913359805018113/photo/1,https://twitter.com/dog_rates/status/792913359805018113/photo/1,https://twitter.com/dog_rates/status/792913359805018113/photo/1	13.0	10		none		2016	October	10-31	Monday	02:17
792883833364439040	2016-10-31 00:20:11	iPhone	This is Bailey She's rather h*ckin hype for Halloween tomorrow Carved those pupkins herself 12/10 https://tco/v17mFm0Ftz	https://twitter.com/dog_rates/status/792883833364439040/photo/1,https://twitter.com/dog_rates/status/792883833364439040/photo/1,https://twitter.com/dog_rates/status/792883833364439040/photo/1,https://twitter.com/dog_rates/status/792883833364439040/photo/1	12.0	10	Bailey	female		2016	October	10-31	Monday	00:20
792773781206999040	2016-10-30 17:02:53	iPhone	This is Monster Not an actual monster tho He's showing you his tongue Very impressive Monster 12/10 would snug https://tco/RhaPExuxJL	https://twitter.com/dog_rates/status/792773781206999040/photo/1	12.0	10	Monster	male		2016	October	10-30	Sunday	17:02
792394556390137856	2016-10-29 15:55:58	iPhone	Meet BeBe She rocks the messy bun of your dreams H*ckin flawless 12/10 would watch her tutorial https://tco/of0pFNBIl8	https://twitter.com/dog_rates/status/792394556390137856/photo/1,https://twitter.com/dog_rates/status/792394556390137856/photo/1	12.0	10		female		2016	October	10-29	Saturday	15:55
792050063153438720	2016-10-28 17:07:05	iPhone	This is Remus He's a mop that came to life Can't see anything Constantly trips over himself Still a very good dog 11/10 https://tco/S3f1SYylzu	https://twitter.com/dog_rates/status/792050063153438720/photo/1,https://twitter.com/dog_rates/status/792050063153438720/photo/1	11.0	10	Remus	male		2016	October	10-28	Friday	17:07
791774931465953280	2016-10-27 22:53:48	Vine	Vine will be deeply missed This was by far my favorite one 14/10 https://tco/roqIxCvEB3	https://vine.co/v/ea0OwvPTx9l	14.0	10		none		2016	October	10-27	Thursday	22:53
791672322847637504	2016-10-27 16:06:04	iPhone	When she says you're a good boy and you know you're a good boy because you're a good boy 13/10 https://tco/O5IUmRHRIh	https://twitter.com/dog_rates/status/791672322847637504/photo/1	13.0	10		female		2016	October	10-27	Thursday	16:06
791406955684368384	2016-10-26 22:31:36	iPhone	Say hello to Levi He's a Madagascan Butterbop One of the more docile Butterbops I've seen 12/10 would give all the pets https://tco/Zcw9Sccctc	https://twitter.com/dog_rates/status/791406955684368384/photo/1,https://twitter.com/dog_rates/status/791406955684368384/photo/1,https://twitter.com/dog_rates/status/791406955684368384/photo/1,https://twitter.com/dog_rates/status/791406955684368384/photo/1	12.0	10	Levi	male		2016	October	10-26	Wednesday	22:31
791312159183634433	2016-10-26 16:14:55	iPhone	This is Mabel She's super h*ckin smol Portable af Comes with the smol shoe 12/10 would keep in frocket https://tco/GGJvxYt3xK	https://twitter.com/dog_rates/status/791312159183634433/photo/1,https://twitter.com/dog_rates/status/791312159183634433/photo/1,https://twitter.com/dog_rates/status/791312159183634433/photo/1,https://twitter.com/dog_rates/status/791312159183634433/photo/1	12.0	10	Mabel	female		2016	October	10-26	Wednesday	16:14
790987426131050500	2016-10-25 18:44:32	iPhone	This is Misty She has a cowboy hat on her nose 12/10 https://tco/Eno0mypHIr	https://twitter.com/dog_rates/status/790987426131050500/photo/1	12.0	10	Misty	female		2016	October	10-25	Tuesday	18:44
790946055508652032	2016-10-25 16:00:09	iPhone	This is Betty She's assisting with the dishes Such a good puppo 12/10 h*ckin helpful af https://tco/dgvTPZ9tgI	https://twitter.com/dog_rates/status/790946055508652032/photo/1	12.0	10	Betty	female	puppo	2016	October	10-25	Tuesday	16:00
790698755171364864	2016-10-24 23:37:28	iPhone	This is Mosby He appears to be rather h*ckin snuggable af 12/10 keep it up Mosby https://tco/IiiBq460I7	https://twitter.com/dog_rates/status/790698755171364864/photo/1	12.0	10	Mosby	male		2016	October	10-24	Monday	23:37
790581949425475584	2016-10-24 15:53:19	iPhone	This is Duke He sneaks into the fridge sometimes It's his safe place 11/10 would give little jacket if necessary https://tco/Fd5WFDTMH4	https://twitter.com/dog_rates/status/790581949425475584/photo/1,https://twitter.com/dog_rates/status/790581949425475584/photo/1	11.0	10	Duke	male		2016	October	10-24	Monday	15:53
790337589677002753	2016-10-23 23:42:19	iPhone	Meet Maggie She can hear your cells divide 12/10 can also probably fly https://tco/ovE2hqXryV	https://twitter.com/dog_rates/status/790337589677002753/photo/1	12.0	10	Maggie	female		2016	October	10-23	Sunday	23:42
790277117346975746	2016-10-23 19:42:02	iPhone	This is Bruce He never backs down from a challenge 11/10 you got this Bruce https://tco/aI7umZHIq7	https://twitter.com/dog_rates/status/790277117346975746/photo/1	11.0	10	Bruce	male		2016	October	10-23	Sunday	19:42
789986466051088384	2016-10-23 00:27:05	iPhone	This is Happy He's a bathtub reviewer Seems to be pleased with this one 12/10 https://tco/Ln89R4FP7v	https://twitter.com/dog_rates/status/789986466051088384/photo/1	12.0	10	Happy	male		2016	October	10-23	Sunday	00:27
789903600034189313	2016-10-22 18:57:48	Vine	This is Ralphy His dreams were just shattered Poor pupper 13/10 it'll be ok Ralphy https://tco/P0kSN6rT6H	https://vine.co/v/5wPT1aBxPQZ	13.0	10	Ralphy	male	pupper	2016	October	10-22	Saturday	18:57
789628658055020548	2016-10-22 00:45:17	iPhone	This is Eli He can fly 13/10 magical af https://tco/huPSJJ7FDI	https://twitter.com/dog_rates/status/789628658055020548/photo/1	13.0	10	Eli	male		2016	October	10-22	Saturday	00:45
789599242079838210	2016-10-21 22:48:24	iPhone	This is Brownie She's wearing a Halloween themed onesie 12/10 festive af https://tco/0R4meWXFOx	https://twitter.com/dog_rates/status/789599242079838210/photo/1,https://twitter.com/dog_rates/status/789599242079838210/photo/1	12.0	10	Brownie	female		2016	October	10-21	Friday	22:48
789530877013393408	2016-10-21 18:16:44	iPhone	This is Rizzy She smiles a lot 12/10 contagious af https://tco/TU4sZogVIq	https://twitter.com/dog_rates/status/789530877013393408/photo/1,https://twitter.com/dog_rates/status/789530877013393408/photo/1,https://twitter.com/dog_rates/status/789530877013393408/photo/1	12.0	10	Rizzy	female		2016	October	10-21	Friday	18:16
789314372632018944	2016-10-21 03:56:25	iPhone	"HE WAS JUST A LIL SLEEPY FROM BEING SUCH A GOOD DOGGI ALL THE TIME MISTAKES HAPPEN 13/10
https://tco/G2ms0A5jWM"	https://twitter.com/sebscat/status/788818328538099712	13.0	10		male		2016	October	10-21	Friday	03:56
789268448748703744	2016-10-21 00:53:56	iPhone	This is Stella She's happier than I will ever be 10/10 would trade lives with https://tco/JSs2bfDtTS	https://twitter.com/dog_rates/status/789268448748703744/photo/1	10.0	10	Stella	female		2016	October	10-21	Friday	00:53
789137962068021249	2016-10-20 16:15:26	iPhone	This is Bo He's a West Congolese Bugaboop Snuggle Rather exotic Master of the head tilt 12/10 would pay to pet https://tco/2jwxxtNzoN	https://twitter.com/dog_rates/status/789137962068021249/photo/1,https://twitter.com/dog_rates/status/789137962068021249/photo/1,https://twitter.com/dog_rates/status/789137962068021249/photo/1	12.0	10		male		2016	October	10-20	Thursday	16:15
788908386943430656	2016-10-20 01:03:11	iPhone	This is Lucy She destroyed not one but two remotes trying to turn off the debate 11/10 relatable af https://tco/3BXh073tDm	https://twitter.com/dog_rates/status/788908386943430656/photo/1	11.0	10	Lucy	female		2016	October	10-20	Thursday	01:03
788765914992902144	2016-10-19 15:37:03	iPhone	This is Butter She can have whatever she wants forever 12/10 would hug softly https://tco/x5gXRS1abq	https://twitter.com/dog_rates/status/788765914992902144/photo/1	12.0	10	Butter	female		2016	October	10-19	Wednesday	15:37
788412144018661376	2016-10-18 16:11:17	iPhone	This is Dexter He breaks hearts for a living 11/10 h*ckin handsome af https://tco/4DhSsC1W7S	https://twitter.com/dog_rates/status/788412144018661376/photo/1,https://twitter.com/dog_rates/status/788412144018661376/photo/1	11.0	10	Dexter	male		2016	October	10-18	Tuesday	16:11
788178268662984705	2016-10-18 00:41:57	iPhone	Atlas is back and this time he's got doggles Still 13/10 solarly conscious af https://tco/s7MgFWDySc	https://twitter.com/dog_rates/status/788178268662984705/photo/1,https://twitter.com/dog_rates/status/788178268662984705/photo/1,https://twitter.com/dog_rates/status/788178268662984705/photo/1,https://twitter.com/dog_rates/status/788178268662984705/photo/1	13.0	10		male		2016	October	10-18	Tuesday	00:41
788150585577050112	2016-10-17 22:51:57	iPhone	This is Leo He's a golden chow Rather h*ckin rare 13/10 would give extra pats https://tco/xosHjFzVXc	https://twitter.com/dog_rates/status/788150585577050112/photo/1,https://twitter.com/dog_rates/status/788150585577050112/photo/1,https://twitter.com/dog_rates/status/788150585577050112/photo/1,https://twitter.com/dog_rates/status/788150585577050112/photo/1	13.0	10	Leo	male		2016	October	10-17	Monday	22:51
788039637453406209	2016-10-17 15:31:05	iPhone	Did did they pick out that license plate? 12/10 for both https://tco/lRmUUOxgbQ	https://twitter.com/dog_rates/status/788039637453406209/photo/1,https://twitter.com/dog_rates/status/788039637453406209/photo/1	12.0	10		none		2016	October	10-17	Monday	15:31
787810552592695296	2016-10-17 00:20:47	iPhone	This is Frank He wears sunglasses and walks himself 11/10 I'll never be this cool or independent https://tco/pNNjBtHWPc	https://twitter.com/dog_rates/status/787810552592695296/photo/1,https://twitter.com/dog_rates/status/787810552592695296/photo/1	11.0	10	Frank	male		2016	October	10-17	Monday	00:20
787717603741622272	2016-10-16 18:11:26	iPhone	This is Tonks She is a service puppo Can hear a caterpillar hiccup from 7 miles away 13/10 would follow anywhere https://tco/i622ZbWkUp	https://twitter.com/dog_rates/status/787717603741622272/photo/1,https://twitter.com/dog_rates/status/787717603741622272/photo/1,https://twitter.com/dog_rates/status/787717603741622272/photo/1,https://twitter.com/dog_rates/status/787717603741622272/photo/1	13.0	10	Tonks	female	puppo	2016	October	10-16	Sunday	18:11
787397959788929025	2016-10-15 21:01:17	iPhone	This is Moose He's rather h*ckin dangerous (you can tell by the collar) 11/10 would still attempt to snug https://tco/lHVHGdDzb3	https://twitter.com/dog_rates/status/787397959788929025/photo/1	11.0	10	Moose	male		2016	October	10-15	Saturday	21:01
787322443945877504	2016-10-15 16:01:13	iPhone	This is Lincoln He forgot to use his blinker when he changed lanes just now Guilty as h*ck Still 10/10 https://tco/lsrR83SiVp	https://twitter.com/dog_rates/status/787322443945877504/photo/1	10.0	10	Lincoln	male		2016	October	10-15	Saturday	16:01
786963064373534720	2016-10-14 16:13:10	iPhone	This is Rory He's got an interview in a few minutes Looking spiffy af Nervous as h*ck tho 12/10 would hire https://tco/ibj5g6xaAj	https://twitter.com/dog_rates/status/786963064373534720/photo/1	12.0	10	Rory	male		2016	October	10-14	Friday	16:13
786709082849828864	2016-10-13 23:23:56	iPhone	This is Logan the Chow who lived He solemnly swears he's up to lots of good H*ckin magical af 975/10 https://tco/yBO5wuqaPS	https://twitter.com/dog_rates/status/786709082849828864/photo/1	9.75	10	Logan	male		2016	October	10-13	Thursday	23:23
786664955043049472	2016-10-13 20:28:35	iPhone	"""Honestly Kathleen I just want more Ken Bone"" 12/10 https://tco/HmlEvAMP4r"	https://twitter.com/dog_rates/status/786664955043049472/photo/1	12.0	10		none		2016	October	10-13	Thursday	20:28
786595970293370880	2016-10-13 15:54:28	iPhone	This is Dale He's a real spookster Did me quite the frighten 11/10 not too spooky to pet tho https://tco/L8BWDD4oBX	https://twitter.com/dog_rates/status/786595970293370880/photo/1	11.0	10	Dale	male		2016	October	10-13	Thursday	15:54
786363235746385920	2016-10-13 00:29:39	iPhone	This is Rizzo He has many talents A true renaissance doggo 13/10 entertaining af https://tco/TVXpEJB7Wn	https://twitter.com/dog_rates/status/786363235746385920/photo/1,https://twitter.com/dog_rates/status/786363235746385920/photo/1,https://twitter.com/dog_rates/status/786363235746385920/photo/1,https://twitter.com/dog_rates/status/786363235746385920/photo/1	13.0	10	Rizzo	male	doggo	2016	October	10-13	Thursday	00:29
