tweet_id	timestamp	source	text	expanded_urls	rating_numerator	rating_denominator	name	gender	dog_stage	year	month	date	day	time
680609293079592961	2015-12-26 04:41:15	iPhone	This is Brody That is his chair He loves his chair Never leaves it 9/10 might be stuck actually https://tco/WvJRg0XJit	https://twitter.com/dog_rates/status/680609293079592961/photo/1	9.0	10	Brody	male		2015	December	12-26	Saturday	04:41
680583894916304897	2015-12-26 03:00:19	iPhone	This is Penny Her tennis ball slowly rolled down her cone and into the pool 8/10 bad things happen to good puppers https://tco/YNWU7LeFgg	https://twitter.com/dog_rates/status/680583894916304897/photo/1,https://twitter.com/dog_rates/status/680583894916304897/photo/1,https://twitter.com/dog_rates/status/680583894916304897/photo/1,https://twitter.com/dog_rates/status/680583894916304897/photo/1	8.0	10	Penny	female	pupper	2015	December	12-26	Saturday	03:00
680497766108381184	2015-12-25 21:18:05	iPhone	Meet Percy He's a Latvian Yuletide Heineken Refuses to take off sweater Kinda feisty 12/10 would keep in pocket https://tco/QGM5Fcuv7s	https://twitter.com/dog_rates/status/680497766108381184/photo/1	12.0	10	Percy	male		2015	December	12-25	Friday	21:18
680494726643068929	2015-12-25 21:06:00	iPhone	Here we have uncovered an entire battalion of holiday puppers Average of 1126/10 https://tco/eNm2S6p9BD	https://twitter.com/dog_rates/status/680494726643068929/photo/1	11.26	10		none	pupper	2015	December	12-25	Friday	21:06
680473011644985345	2015-12-25 19:39:43	iPhone	This is Hector He thinks he's a hammer Silly Hector You're a pupper not a hammer 10/10 https://tco/OdUFuZIXiI	https://twitter.com/dog_rates/status/680473011644985345/photo/1	10.0	10	Hector	male	pupper	2015	December	12-25	Friday	19:39
680440374763077632	2015-12-25 17:30:01	iPhone	Merry Christmas My gift to you is this tiny unicorn running into a wall in slow motion 11/10 https://tco/UKqIAnR3He	https://twitter.com/dog_rates/status/680440374763077632/video/1	11.0	10		none		2015	December	12-25	Friday	17:30
680221482581123072	2015-12-25 03:00:14	iPhone	This is CeCe She's patiently waiting for Santa 10/10 https://tco/ZJUypFFwvg	https://twitter.com/dog_rates/status/680221482581123072/photo/1	10.0	10		female		2015	December	12-25	Friday	03:00
680206703334408192	2015-12-25 02:01:30	iPhone	I hope everyone enjoys this picture as much as I do This is Toby 12/10 https://tco/vHnu1g9EJm	https://twitter.com/dog_rates/status/680206703334408192/photo/1	12.0	10	Toby	none		2015	December	12-25	Friday	02:01
680191257256136705	2015-12-25 01:00:07	iPhone	Here's a sleepy Christmas pupper 11/10 https://tco/KXg0f8GNQ9	https://twitter.com/dog_rates/status/680191257256136705/photo/1	11.0	10		none	pupper	2015	December	12-25	Friday	01:00
680176173301628928	2015-12-25 00:00:11	iPhone	This pupper is patiently waiting to scare the shit out of Santa 10/10 https://tco/NhXo67K6yt	https://twitter.com/dog_rates/status/680176173301628928/photo/1	10.0	10		none	pupper	2015	December	12-25	Friday	00:00
680161097740095489	2015-12-24 23:00:17	iPhone	Meet Goliath He's an example of irony Head is phenomenally round Wants to be an ornament 12/10 would hug gently https://tco/72Dil0Aktw	https://twitter.com/dog_rates/status/680161097740095489/photo/1	12.0	10	Goliath	male		2015	December	12-24	Thursday	23:00
680145970311643136	2015-12-24 22:00:10	iPhone	Say hello to Kawhi He was doing fine until his hat fell off He got it back though 10/10 deep breaths pupper https://tco/N5pM6WBx7e	https://twitter.com/dog_rates/status/680145970311643136/photo/1,https://twitter.com/dog_rates/status/680145970311643136/photo/1,https://twitter.com/dog_rates/status/680145970311643136/photo/1	10.0	10	Kawhi	male	pupper	2015	December	12-24	Thursday	22:00
680130881361686529	2015-12-24 21:00:12	iPhone	This is Reggie His Santa hat is a little big 10/10 he's still having fun https://tco/w0dcGXq7qK	https://twitter.com/dog_rates/status/680130881361686529/photo/1	10.0	10	Reggie	male		2015	December	12-24	Thursday	21:00
680115823365742593	2015-12-24 20:00:22	iPhone	This is Ozzy He woke up 2 minutes before he had to be ready for the Christmas party 9/10 classic Ozzy https://tco/Kt9vmw0Fap	https://twitter.com/dog_rates/status/680115823365742593/photo/1	9.0	10	Ozzy	male		2015	December	12-24	Thursday	20:00
680100725817409536	2015-12-24 19:00:23	TweetDeck	This pupper is not coming inside until she catches a snowflake on her tongue 11/10 the determination is palpable https://tco/lvMYbmKq8H	https://twitter.com/dog_rates/status/680100725817409536/photo/1	11.0	10		female	pupper	2015	December	12-24	Thursday	19:00
680085611152338944	2015-12-24 18:00:19	TweetDeck	This is by far the most coordinated series of pictures I was sent Downright impressive in every way 12/10 for all https://tco/etzLo3sdZE	https://twitter.com/dog_rates/status/680085611152338944/photo/1,https://twitter.com/dog_rates/status/680085611152338944/photo/1,https://twitter.com/dog_rates/status/680085611152338944/photo/1	12.0	10		none		2015	December	12-24	Thursday	18:00
680070545539371008	2015-12-24 17:00:27	TweetDeck	Say hello to Emmie She's trapped in an ornament Tragic af Looks pretty content tho Maybe it's meant to be 9/10 https://tco/Fh7geodBCU	https://twitter.com/dog_rates/status/680070545539371008/photo/1	9.0	10	Emmie	female		2015	December	12-24	Thursday	17:00
680055455951884288	2015-12-24 16:00:30	TweetDeck	"Meet Sammy At first I was like ""that's a snowflake we only rate dogs"" but he would've melted by now so 10/10 https://tco/MQfPK4zwuh"	https://twitter.com/dog_rates/status/680055455951884288/photo/1	10.0	10	Sammy	male		2015	December	12-24	Thursday	16:00
679877062409191424	2015-12-24 04:11:37	iPhone	Meet Penelope She's a bacon frise Total babe (lol get it like the movie) Doesn't bark tho 5/10 very average dog https://tco/SDcQYg0HSZ	https://twitter.com/dog_rates/status/679877062409191424/photo/1	5.0	10	Penelope	female		2015	December	12-24	Thursday	04:11
679872969355714560	2015-12-24 03:55:21	Vine	This is Rocco He's in a very intense game of freeze tag Currently waiting to be unfrozen 10/10 https://tco/xZXUKVXJ7l	https://vine.co/v/iAAxTbj1UAM	10.0	10	Rocco	male		2015	December	12-24	Thursday	03:55
679862121895714818	2015-12-24 03:12:15	iPhone	"""Dammit hooman I'm jus trynna lik the fler"" 11/10 https://tco/eRZRI8OTj7"	https://twitter.com/dog_rates/status/679862121895714818/photo/1	11.0	10		none		2015	December	12-24	Thursday	03:12
679854723806179328	2015-12-24 02:42:51	iPhone	This is Bruce He's a rare pup Covered in Frosted Flakes Nifty gold teeth Overall good dog 7/10 would pet firmly https://tco/RtxxACzZ8A	https://twitter.com/dog_rates/status/679854723806179328/photo/1	7.0	10	Bruce	male		2015	December	12-24	Thursday	02:42
679844490799091713	2015-12-24 02:02:12	iPhone	This is Willie He's floating away and needs your assistance Please someone help Willie 10/10 https://tco/MJqygWqt8X	https://twitter.com/dog_rates/status/679844490799091713/photo/1	10.0	10	Willie	male		2015	December	12-24	Thursday	02:02
679828447187857408	2015-12-24 00:58:27	iPhone	Everybody look at this beautiful pupper 13/10 https://tco/hyAC5Hq9GC	https://twitter.com/dog_rates/status/679828447187857408/photo/1,https://twitter.com/dog_rates/status/679828447187857408/photo/1,https://twitter.com/dog_rates/status/679828447187857408/photo/1	13.0	10		none	pupper	2015	December	12-24	Thursday	00:58
679777920601223168	2015-12-23 21:37:40	iPhone	This is Rinna She's melting 10/10 get inside pupper https://tco/PA0czwucsb	https://twitter.com/dog_rates/status/679777920601223168/photo/1	10.0	10	Rinna	female	pupper	2015	December	12-23	Wednesday	21:37
679736210798047232	2015-12-23 18:51:56	iPhone	This pup's name is Sabertooth (parents must be cool) Ears for days Jumps unannounced 9/10 would pet diligently https://tco/iazoiNUviP	https://twitter.com/dog_rates/status/679736210798047232/photo/1	9.0	10	Sabertooth	none		2015	December	12-23	Wednesday	18:51
679729593985699840	2015-12-23 18:25:38	iPhone	This is Hunter He was playing with his ball minding his own business Has no idea what happened to the carpet 8/10 https://tco/DbUTDI3u1R	https://twitter.com/dog_rates/status/679729593985699840/photo/1	8.0	10	Hunter	male		2015	December	12-23	Wednesday	18:25
679722016581222400	2015-12-23 17:55:32	iPhone	This is Mike He is a Jordanian Frito Pilates Frowning because he can't see directly in front of him 8/10 https://tco/NL5QJwdEpF	https://twitter.com/dog_rates/status/679722016581222400/photo/1	8.0	10	Mike	male		2015	December	12-23	Wednesday	17:55
679530280114372609	2015-12-23 05:13:38	iPhone	Guys this really needs to stop We've been over this way too many times This is a giraffe We only rate dogs 7/10 https://tco/yavgkHYPOC	https://twitter.com/dog_rates/status/679530280114372609/photo/1	7.0	10		none		2015	December	12-23	Wednesday	05:13
679527802031484928	2015-12-23 05:03:47	iPhone	This little pupper just arrived 11/10 would snug https://tco/DA5aqnSGfB	https://twitter.com/dog_rates/status/679527802031484928/photo/1	11.0	10		none	pupper	2015	December	12-23	Wednesday	05:03
679511351870550016	2015-12-23 03:58:25	iPhone	Say hello to William He makes fun of others because he's terrified of his own deep-seated insecurities 7/10 https://tco/bwuV6FlRxr	https://twitter.com/dog_rates/status/679511351870550016/photo/1	7.0	10	William	male		2015	December	12-23	Wednesday	03:58
679503373272485890	2015-12-23 03:26:43	iPhone	This is Dwight He's a pointy pupper Very docile Attracts marshmallows Hurts to pet but definitely worth it 8/10 https://tco/jjW7zTxY9Z	https://twitter.com/dog_rates/status/679503373272485890/photo/1	8.0	10	Dwight	male	pupper	2015	December	12-23	Wednesday	03:26
679475951516934144	2015-12-23 01:37:45	iPhone	This is Evy She doesn't want to be a Koala 9/10 https://tco/VITeF0Kl9L	https://twitter.com/dog_rates/status/679475951516934144/photo/1	9.0	10	Evy	female		2015	December	12-23	Wednesday	01:37
679462823135686656	2015-12-23 00:45:35	iPhone	Meet Hurley He's the curly one He hugs every other dog he sees during his walk 11/10 for spreading the love https://tco/M6vqkt2GKV	https://twitter.com/dog_rates/status/679462823135686656/photo/1	11.0	10	Hurley	male		2015	December	12-23	Wednesday	00:45
679405845277462528	2015-12-22 20:59:10	Vine	Crazy unseen footage from Jurassic Park 10/10 for both dinosaur puppers https://tco/L8wt2IpwxO	https://vine.co/v/iKVFEigMLxP	10.0	10		none	pupper	2015	December	12-22	Tuesday	20:59
679158373988876288	2015-12-22 04:35:49	iPhone	This is Rubio He has too much skin 11/10 https://tco/NLOHmlENag	https://twitter.com/dog_rates/status/679158373988876288/photo/1	11.0	10	Rubio	male		2015	December	12-22	Tuesday	04:35
679148763231985668	2015-12-22 03:57:37	iPhone	I know everyone's excited for Christmas but that doesn't mean you can send in reindeer We only rate dogs 8/10 https://tco/eWjWgbOCYL	https://twitter.com/dog_rates/status/679148763231985668/photo/1	8.0	10		none		2015	December	12-22	Tuesday	03:57
679132435750195208	2015-12-22 02:52:45	iPhone	This is Louis He's a river dancer His friends think it's badass All are very supportive 10/10 for Louis https://tco/qoIvjKMY58	https://twitter.com/dog_rates/status/679132435750195208/photo/1	10.0	10	Louis	male		2015	December	12-22	Tuesday	02:52
679111216690831360	2015-12-22 01:28:25	iPhone	This is officially the greatest yawn of all time 12/10 https://tco/4R0Cc0sLVE	https://twitter.com/dog_rates/status/679111216690831360/video/1	12.0	10		none		2015	December	12-22	Tuesday	01:28
679062614270468097	2015-12-21 22:15:18	iPhone	This is Chompsky He lives up to his name 11/10 https://tco/Xl37lQEWd0	https://twitter.com/dog_rates/status/679062614270468097/photo/1,https://twitter.com/dog_rates/status/679062614270468097/photo/1	11.0	10	Chompsky	male		2015	December	12-21	Monday	22:15
679047485189439488	2015-12-21 21:15:11	iPhone	This dog doesn't know how to stairs Quite tragic really 9/10 get it together pup https://tco/kTpr9PTMg1	https://twitter.com/dog_rates/status/679047485189439488/photo/1	9.0	10		none		2015	December	12-21	Monday	21:15
679001094530465792	2015-12-21 18:10:50	Vine	This is Rascal He's paddling an imaginary canoe 11/10 https://tco/Ajquq6oGSg	https://vine.co/v/iKIwAzEatd6	11.0	10	Rascal	male		2015	December	12-21	Monday	18:10
678991772295516161	2015-12-21 17:33:48	iPhone	If your Monday isn't going so well just take a look at this Both 12/10 https://tco/GJT6SILPGU	https://twitter.com/dog_rates/status/678991772295516161/photo/1	12.0	10		none		2015	December	12-21	Monday	17:33
678969228704284672	2015-12-21 16:04:13	iPhone	Meet Lola She's a Metamorphic Chartreuse Plays with her food Insubordinate and churlish Exquisite hardwood 11/10 https://tco/etpBNXwN7f	https://twitter.com/dog_rates/status/678969228704284672/photo/1	11.0	10	Lola	female		2015	December	12-21	Monday	16:04
678800283649069056	2015-12-21 04:52:53	iPhone	Here's a pupper with some mean tan lines Snazzy sweater though 12/10 https://tco/DpCSVsl6vu	https://twitter.com/dog_rates/status/678800283649069056/photo/1	12.0	10		none	pupper	2015	December	12-21	Monday	04:52
678798276842360832	2015-12-21 04:44:55	iPhone	This is Linda She fucking hates trees 7/10 https://tco/blaY85FIxR	https://twitter.com/dog_rates/status/678798276842360832/photo/1	7.0	10	Linda	female		2015	December	12-21	Monday	04:44
678774928607469569	2015-12-21 03:12:08	iPhone	This is Tug He's not required to wear the cone he just wants his voice to project more clearly 11/10 https://tco/Sp739Ou2qx	https://twitter.com/dog_rates/status/678774928607469569/photo/1	11.0	10	Tug	male		2015	December	12-21	Monday	03:12
678767140346941444	2015-12-21 02:41:11	iPhone	This is Mia She makes awful decisions 8/10 https://tco/G6TQVgTcZz	https://twitter.com/dog_rates/status/678767140346941444/photo/1	8.0	10	Mia	female		2015	December	12-21	Monday	02:41
678764513869611008	2015-12-21 02:30:45	iPhone	"Meet Wilson He got caught humping the futon He's like ""dude help me out here"" 10/10 I'd help Wilson out https://tco/m6XoclB0qv"	https://twitter.com/dog_rates/status/678764513869611008/photo/1	10.0	10	Wilson	male		2015	December	12-21	Monday	02:30
678755239630127104	2015-12-21 01:53:54	iPhone	This is Dash He didn't think the water would be that cold Damn it Dash it's December Think a little 10/10 https://tco/NqcOwG8pxW	https://twitter.com/dog_rates/status/678755239630127104/photo/1	10.0	10	Dash	male		2015	December	12-21	Monday	01:53
678740035362037760	2015-12-21 00:53:29	iPhone	Meet Tango He's a large dog Doesn't care much for personal space Owner isn't very accepting Tongue slip 6/10 https://tco/p2T5kGebxe	https://twitter.com/dog_rates/status/678740035362037760/photo/1	6.0	10	Tango	male		2015	December	12-21	Monday	00:53
678708137298427904	2015-12-20 22:46:44	Vine	Here we are witnessing a wild field pupper Lost his wallet in there Rather unfortunate 10/10 good luck pup https://tco/sZy9Co74Bw	https://vine.co/v/eQjxxYaQ60K	10.0	10		male	pupper	2015	December	12-20	Sunday	22:46
678675843183484930	2015-12-20 20:38:24	iPhone	Exotic pup here Tail long af Throat looks swollen Might breathe fire Exceptionally unfluffy 2/10 would still pet https://tco/a8SqCaSo2r	https://twitter.com/dog_rates/status/678675843183484930/photo/1	2.0	10		none		2015	December	12-20	Sunday	20:38
678643457146150913	2015-12-20 18:29:43	iPhone	Meet Grizz He just arrived Couldn't wait until Christmas Worried bc he saw the swastikas on the carpet 10/10 https://tco/QBGwYrT7rv	https://twitter.com/dog_rates/status/678643457146150913/photo/1	10.0	10	Grizz	male		2015	December	12-20	Sunday	18:29
678446151570427904	2015-12-20 05:25:42	iPhone	Touching scene here Really stirs up the emotions The bond between father &amp; son So beautiful 10/10 for both pups https://tco/AJWJHov5gx	https://twitter.com/dog_rates/status/678446151570427904/photo/1	10.0	10		none		2015	December	12-20	Sunday	05:25
678424312106393600	2015-12-20 03:58:55	iPhone	This is Crystal She's a shitty fireman No sense of urgency People could be dying Crystal 2/10 just irresponsible https://tco/rtMtjSl9pz	https://twitter.com/dog_rates/status/678424312106393600/photo/1	2.0	10	Crystal	female		2015	December	12-20	Sunday	03:58
678410210315247616	2015-12-20 03:02:53	iPhone	Say hello to Jerome He can shoot french fries out of his mouth at insane speeds Deadly af 10/10 https://tco/dIy88HwrX8	https://twitter.com/dog_rates/status/678410210315247616/photo/1	10.0	10	Jerome	male		2015	December	12-20	Sunday	03:02
678399652199309312	2015-12-20 02:20:55	iPhone	This made my day 12/10 please enjoy https://tco/VRTbo3aAcm	https://twitter.com/dog_rates/status/678399652199309312/video/1	12.0	10		none		2015	December	12-20	Sunday	02:20
678396796259975168	2015-12-20 02:09:34	iPhone	These little fellas have opposite facial expressions Both 12/10 https://tco/LmThv0GWen	https://twitter.com/dog_rates/status/678396796259975168/photo/1,https://twitter.com/dog_rates/status/678396796259975168/photo/1	12.0	10		none		2015	December	12-20	Sunday	02:09
678389028614488064	2015-12-20 01:38:42	iPhone	"This is Bella She just learned that her final grade in chem was a 9249 
poor pupper 11/10 https://tco/auOoKuoveM"	https://twitter.com/dog_rates/status/678389028614488064/photo/1	11.0	10	Bella	female	pupper	2015	December	12-20	Sunday	01:38
678380236862578688	2015-12-20 01:03:46	iPhone	This is Crumpet He underestimated the snow Quickly retreating 10/10 https://tco/a0Zx5LDFZa	https://twitter.com/dog_rates/status/678380236862578688/photo/1	10.0	10	Crumpet	male		2015	December	12-20	Sunday	01:03
678341075375947776	2015-12-19 22:28:09	iPhone	This pupper likes tape 12/10 https://tco/cSp6w5GWgm	https://twitter.com/dog_rates/status/678341075375947776/photo/1	12.0	10		none	pupper	2015	December	12-19	Saturday	22:28
678334497360859136	2015-12-19 22:02:01	iPhone	This is Rosie She has a snazzy bow tie and a fin for a tail Probably super fast underwater Cool socks 10/10 https://tco/GO76MdGBs0	https://twitter.com/dog_rates/status/678334497360859136/photo/1	10.0	10	Rosie	female		2015	December	12-19	Saturday	22:02
678278586130948096	2015-12-19 18:19:51	iPhone	Another spooky pupper here Most definitely floating No legs Probably knows some dark magic 10/10 very spooked https://tco/JK8MByRzgj	https://twitter.com/dog_rates/status/678278586130948096/photo/1	10.0	10		none	pupper	2015	December	12-19	Saturday	18:19
678255464182861824	2015-12-19 16:47:58	iPhone	This is Jessifer She is a Bismoth Teriyaki Flowers being attacked by hurricanes on bandana (rad) 9/10 stellar pup https://tco/nZhmRwZzWv	https://twitter.com/dog_rates/status/678255464182861824/photo/1	9.0	10	Jessifer	female		2015	December	12-19	Saturday	16:47
678021115718029313	2015-12-19 01:16:45	iPhone	This is Reese He likes holding hands 12/10 https://tco/cbLroGCbmh	https://twitter.com/dog_rates/status/678021115718029313/photo/1	12.0	10	Reese	male		2015	December	12-19	Saturday	01:16
677961670166224897	2015-12-18 21:20:32	Vine	This is Izzy She's showing off the dance moves she's been working on 11/10 I guess hard work pays off https://tco/4JS92YAxTi	https://vine.co/v/iKuMDuYV0aZ	11.0	10	Izzy	female		2015	December	12-18	Friday	21:20
677918531514703872	2015-12-18 18:29:07	iPhone	"""Everything looks pretty good in there Make sure to brush your gums Been flossing? How's school going?"" Both 10/10 https://tco/lWL2IMJqLR"	https://twitter.com/dog_rates/status/677918531514703872/photo/1	10.0	10		none		2015	December	12-18	Friday	18:29
677895101218201600	2015-12-18 16:56:01	iPhone	Guys this was terrifying Really spooked me up We don't rate ghosts We rate dogs Please only send dogs 9/10 https://tco/EJImi1udYb	https://twitter.com/dog_rates/status/677895101218201600/photo/1	9.0	10		none		2015	December	12-18	Friday	16:56
677716515794329600	2015-12-18 05:06:23	iPhone	IT'S PUPPERGEDDON Total of 144/120 I think https://tco/ZanVtAtvIq	https://twitter.com/dog_rates/status/677716515794329600/photo/1	12.0	10		none		2015	December	12-18	Friday	05:06
677700003327029250	2015-12-18 04:00:46	iPhone	This is Ralph He's an interpretive dancer 10/10 https://tco/zoDdPyPFsa	https://twitter.com/dog_rates/status/677700003327029250/photo/1	10.0	10	Ralph	male		2015	December	12-18	Friday	04:00
677698403548192770	2015-12-18 03:54:25	iPhone	This is Sadie She got her holidays confused 9/10 damn it Sadie https://tco/fm7HxOsuPK	https://twitter.com/dog_rates/status/677698403548192770/photo/1	9.0	10	Sadie	female		2015	December	12-18	Friday	03:54
677687604918272002	2015-12-18 03:11:30	iPhone	This was Cindy's face when she heard Susan forgot the snacks for after the kid's soccer game 11/10 https://tco/gzkuVGRgAD	https://twitter.com/dog_rates/status/677687604918272002/photo/1	11.0	10		female		2015	December	12-18	Friday	03:11
677673981332312066	2015-12-18 02:17:22	iPhone	Endangered triangular pup here Could be a wizard Caught mid-laugh No legs Just fluff Probably a wizard 9/10 https://tco/GFVIHIod0Z	https://twitter.com/dog_rates/status/677673981332312066/photo/1	9.0	10		none		2015	December	12-18	Friday	02:17
677662372920729601	2015-12-18 01:31:14	iPhone	In honor of the new Star Wars movie Here's Yoda pug 12/10 pet really well would I https://tco/pvjdRn00XH	https://twitter.com/dog_rates/status/677662372920729601/photo/1	12.0	10		none		2015	December	12-18	Friday	01:31
677644091929329666	2015-12-18 00:18:36	iPhone	This is a dog swinging I really enjoyed it so I hope you all do as well 11/10 https://tco/Ozo9KHTRND	https://twitter.com/dog_rates/status/677644091929329666/video/1	11.0	10		none		2015	December	12-18	Friday	00:18
677573743309385728	2015-12-17 19:39:03	iPhone	This is Sandy He's sexually confused Thinks he's a pigeon Also an All-American cheese catcher 10/10 so petable https://tco/Htu8plSqEu	https://twitter.com/dog_rates/status/677573743309385728/photo/1,https://twitter.com/dog_rates/status/677573743309385728/photo/1	10.0	10	Sandy	male		2015	December	12-17	Thursday	19:39
677565715327688705	2015-12-17 19:07:09	iPhone	Contortionist pup here Inside pentagram Clearly worships Satan Known to slowly push fragile stuff off tables 6/10 https://tco/EX9oR55VMe	https://twitter.com/dog_rates/status/677565715327688705/photo/1	6.0	10		none		2015	December	12-17	Thursday	19:07
677557565589463040	2015-12-17 18:34:46	iPhone	Reckless pupper here Not even looking at road Absolute menace No regard for fellow pupper lives 10/10 still cute https://tco/96IBkOYB7j	https://twitter.com/dog_rates/status/677557565589463040/photo/1	10.0	10		none	pupper	2015	December	12-17	Thursday	18:34
677547928504967168	2015-12-17 17:56:29	iPhone	Not much to say here I just think everyone needs to see this 12/10 https://tco/AGag0hFHpe	https://twitter.com/dog_rates/status/677547928504967168/photo/1	12.0	10		none		2015	December	12-17	Thursday	17:56
677530072887205888	2015-12-17 16:45:31	iPhone	Say hello to Axel He's a Black Chevy Pinot on wheels 0 to 60 in 57 seconds (if downhill) 9/10 I call shotgun https://tco/DKe9DBnnHE	https://twitter.com/dog_rates/status/677530072887205888/photo/1	9.0	10	Axel	male		2015	December	12-17	Thursday	16:45
677335745548390400	2015-12-17 03:53:20	Vine	Downright inspiring 12/10 https://tco/vSLtYBWHcQ	https://vine.co/v/hbLbH77Ar67	12.0	10		none		2015	December	12-17	Thursday	03:53
677334615166730240	2015-12-17 03:48:51	iPhone	This dog gave up mid jump 9/10 https://tco/KmMv3Y2zI8	https://twitter.com/dog_rates/status/677334615166730240/photo/1,https://twitter.com/dog_rates/status/677334615166730240/photo/1	9.0	10		none		2015	December	12-17	Thursday	03:48
677331501395156992	2015-12-17 03:36:28	iPhone	Meet Humphrey He's a Northern Polyp Viagra One ear works Face stuck like that Always surprised 9/10 petable af https://tco/FS7eJQM2F4	https://twitter.com/dog_rates/status/677331501395156992/photo/1	9.0	10	Humphrey	male		2015	December	12-17	Thursday	03:36
677328882937298944	2015-12-17 03:26:04	iPhone	This is Derek All the dogs adore Derek He's a great guy 10/10 really solid pup https://tco/KgcsGNb61s	https://twitter.com/dog_rates/status/677328882937298944/photo/1	10.0	10	Derek	male		2015	December	12-17	Thursday	03:26
677314812125323265	2015-12-17 02:30:09	iPhone	Meet Tassy &amp; Bee Tassy is pretty chill but Bee is convinced the Ruffles are haunted 10/10 &amp; 11/10 respectively https://tco/fgORpmTN9C	https://twitter.com/dog_rates/status/677314812125323265/photo/1,https://twitter.com/dog_rates/status/677314812125323265/photo/1	10.0	10	Tassy	none		2015	December	12-17	Thursday	02:30
677301033169788928	2015-12-17 01:35:24	iPhone	This is Juckson He's totally on his way to a nascar race 5/10 for Juckson https://tco/IoLRvF0Kak	https://twitter.com/dog_rates/status/677301033169788928/photo/1	5.0	10	Juckson	male		2015	December	12-17	Thursday	01:35
677269281705472000	2015-12-16 23:29:14	iPhone	This is the happiest pupper I've ever seen 10/10 would trade lives with https://tco/ep8ATEJwRb	https://twitter.com/dog_rates/status/677269281705472000/photo/1	10.0	10		none	pupper	2015	December	12-16	Wednesday	23:29
677228873407442944	2015-12-16 20:48:40	iPhone	Say hello to Chuq He just wants to fit in 11/10 https://tco/hGkMCjZzn4	https://twitter.com/dog_rates/status/677228873407442944/photo/1	11.0	10	Chuq	male		2015	December	12-16	Wednesday	20:48
677187300187611136	2015-12-16 18:03:28	iPhone	Here we see a Byzantine Rigatoni Very aerodynamic No eyes Actually not windy here they just look like that 9/10 https://tco/gzI0m6wXRo	https://twitter.com/dog_rates/status/677187300187611136/photo/1	9.0	10		none		2015	December	12-16	Wednesday	18:03
676975532580409345	2015-12-16 04:01:59	iPhone	This is Cooper He doesn't know how cheese works Likes the way it feels on his face Cheeky tongue slip 11/10 https://tco/j1zczS0lI5	https://twitter.com/dog_rates/status/676975532580409345/photo/1	11.0	10	Cooper	male		2015	December	12-16	Wednesday	04:01
676957860086095872	2015-12-16 02:51:45	iPhone	10/10 I'd follow this dog into battle no questions asked https://tco/ngTNXYQF0L	https://twitter.com/dog_rates/status/676957860086095872/video/1	10.0	10		none		2015	December	12-16	Wednesday	02:51
