tweet_id	timestamp	source	text	expanded_urls	rating_numerator	rating_denominator	name	gender	dog_stage	year	month	date	day	time
723912936180330496	2016-04-23 16:34:28	iPhone	This is Sugar She's a Bolivian Superfloof Spherical af 12/10 would never let go of https://tco/AhMfUu6Onm	https://twitter.com/dog_rates/status/723912936180330496/photo/1	12.0	10	Sugar	female		2016	April	04-23	Saturday	16:34
723688335806480385	2016-04-23 01:41:59	iPhone	This is Reginald He starts screaming at random 12/10 cuddly af https://tco/YgNuDQbv89	https://twitter.com/dog_rates/status/723688335806480385/photo/1,https://twitter.com/dog_rates/status/723688335806480385/photo/1	12.0	10	Reginald	male		2016	April	04-23	Saturday	01:41
723673163800948736	2016-04-23 00:41:42	iPhone	This is Ivar She is a badass Viking warrior Will sack your village 10/10 savage af https://tco/Dz6MiVssVU	https://twitter.com/dog_rates/status/723673163800948736/photo/1	10.0	10	Ivar	female		2016	April	04-23	Saturday	00:41
723179728551723008	2016-04-21 16:00:57	iPhone	This is Jangle She's addicted to broccoli It's the only thing she cares about Tragic af 8/10 get help pup https://tco/8dNWp1cSEa	https://twitter.com/dog_rates/status/723179728551723008/photo/1	8.0	10	Jangle	female		2016	April	04-21	Thursday	16:00
722974582966214656	2016-04-21 02:25:47	iPhone	Happy 4/20 from the squad! 13/10 for all https://tco/eV1diwds8a	https://twitter.com/dog_rates/status/722974582966214656/photo/1	13.0	10		none		2016	April	04-21	Thursday	02:25
722613351520608256	2016-04-20 02:30:23	iPhone	Meet Schnitzel He's a Tropicana Floofboop Getting too big for his favorite basket 12/10 just so damn fluffy https://tco/qjd0UJKYUY	https://twitter.com/dog_rates/status/722613351520608256/photo/1	12.0	10	Schnitzel	male		2016	April	04-20	Wednesday	02:30
721503162398597120	2016-04-17 00:58:53	iPhone	This is Panda He's happy af 11/10 https://tco/IOAk9i4UvE	https://twitter.com/dog_rates/status/721503162398597120/photo/1,https://twitter.com/dog_rates/status/721503162398597120/photo/1,https://twitter.com/dog_rates/status/721503162398597120/photo/1,https://twitter.com/dog_rates/status/721503162398597120/photo/1	11.0	10	Panda	male		2016	April	04-17	Sunday	00:58
721001180231503872	2016-04-15 15:44:11	iPhone	This is Oliver Bath time is upon him His fear of the wetness postpones his ultimate pupper destiny 11/10 https://tco/AFzzKqR4tT	https://twitter.com/dog_rates/status/721001180231503872/photo/1	11.0	10	Oliver	male	pupper	2016	April	04-15	Friday	15:44
720785406564900865	2016-04-15 01:26:47	iPhone	This is Archie He hears everything you say Doesn't matter where you are 12/10 https://tco/0l4I8famYp	https://twitter.com/dog_rates/status/720785406564900865/photo/1	12.0	10	Archie	male		2016	April	04-15	Friday	01:26
720775346191278080	2016-04-15 00:46:48	iPhone	This is Berkeley He's in a predicament 10/10 someone help him https://tco/XSEXdQupej	https://twitter.com/dog_rates/status/720775346191278080/photo/1	10.0	10	Berkeley	male		2016	April	04-15	Friday	00:46
720415127506415616	2016-04-14 00:55:25	iPhone	Garden's coming in nice this year 10/10 https://tco/5Lra3e4rrw	https://twitter.com/dog_rates/status/720415127506415616/photo/1,https://twitter.com/dog_rates/status/720415127506415616/photo/1,https://twitter.com/dog_rates/status/720415127506415616/photo/1	10.0	10		none		2016	April	04-14	Thursday	00:55
720389942216527872	2016-04-13 23:15:21	iPhone	This is RalphÃ© He patrols the lake Looking for babes 11/10 https://tco/Pb6iMmo0wk	https://twitter.com/dog_rates/status/720389942216527872/photo/1	11.0	10	Ralph	male		2016	April	04-13	Wednesday	23:15
720340705894408192	2016-04-13 19:59:42	iPhone	This is Derek He just got balled on Can't even get up Poor thing 10/10 hang in there pupper https://tco/BIRRF3bcWH	https://twitter.com/dog_rates/status/720340705894408192/photo/1	10.0	10	Derek	male	pupper	2016	April	04-13	Wednesday	19:59
720059472081784833	2016-04-13 01:22:10	iPhone	This is Charleson He lost his plunger Looked everywhere Can't find it So sad 9/10 would comfort https://tco/pRHX8yn9Yu	https://twitter.com/dog_rates/status/720059472081784833/photo/1	9.0	10	Charleson	male		2016	April	04-13	Wednesday	01:22
720043174954147842	2016-04-13 00:17:25	iPhone	This is Neptune He's a Snowy Swiss Mountain Floofapolis Cheeky wink Tongue nifty af 11/10 would pet so firmly https://tco/SoZq2Xoopv	https://twitter.com/dog_rates/status/720043174954147842/photo/1	11.0	10	Neptune	male		2016	April	04-13	Wednesday	00:17
719991154352222208	2016-04-12 20:50:42	iPhone	This doggo was initially thrilled when she saw the happy cartoon pup but quickly realized she'd been deceived 10/10 https://tco/mvnBGaWULV	https://twitter.com/dog_rates/status/719991154352222208/photo/1,https://twitter.com/dog_rates/status/719991154352222208/photo/1	10.0	10		female	doggo	2016	April	04-12	Tuesday	20:50
719704490224398336	2016-04-12 01:51:36	iPhone	This is Clyde He's making sure you're having a good train ride 12/10 great pupper https://tco/y206kWHAj0	https://twitter.com/dog_rates/status/719704490224398336/photo/1	12.0	10	Clyde	male	pupper	2016	April	04-12	Tuesday	01:51
719551379208073216	2016-04-11 15:43:12	iPhone	This is Harnold He accidentally opened the front facing camera 10/10 get it together Harnold https://tco/S6JHaSMtln	https://twitter.com/dog_rates/status/719551379208073216/photo/1	10.0	10	Harnold	male		2016	April	04-11	Monday	15:43
719367763014393856	2016-04-11 03:33:34	iPhone	Meet Sid &amp; Murphy Murphy floats alongside Sid and whispers motivational quotes in his ear Magical af Both 11/10 https://tco/7mmjyearQW	https://twitter.com/dog_rates/status/719367763014393856/photo/1	11.0	10	Sid	male		2016	April	04-11	Monday	03:33
719339463458033665	2016-04-11 01:41:07	iPhone	Say hello to Lucy and Sophie They think they're the same size Both 10/10 would snug at same time https://tco/HW50zkcf2R	https://twitter.com/dog_rates/status/719339463458033665/photo/1	10.0	10	Lucy	none		2016	April	04-11	Monday	01:41
719332531645071360	2016-04-11 01:13:34	iPhone	This is Pippa She managed to start the car but is waiting for you to buckle up before driving Responsible af 11/10 https://tco/htrlmC7saz	https://twitter.com/dog_rates/status/719332531645071360/photo/1	11.0	10	Pippa	female		2016	April	04-11	Monday	01:13
718971898235854848	2016-04-10 01:20:33	iPhone	This is Sadie She is prepared for battle 10/10 https://tco/JRckDkZVRT	https://twitter.com/dog_rates/status/718971898235854848/photo/1	10.0	10	Sadie	female		2016	April	04-10	Sunday	01:20
718939241951195136	2016-04-09 23:10:47	iPhone	This is Otis Everybody look at Otis 12/10 would probably faint while petting https://tco/I9qoe1uEih	https://twitter.com/dog_rates/status/718939241951195136/photo/1	12.0	10	Otis	none		2016	April	04-09	Saturday	23:10
718631497683582976	2016-04-09 02:47:55	iPhone	We normally don't rate marshmallows but this one appears to be flawlessly toasted so I'll make an exception 10/10 https://tco/D9jbbmPmos	https://twitter.com/dog_rates/status/718631497683582976/photo/1	10.0	10		none		2016	April	04-09	Saturday	02:47
718613305783398402	2016-04-09 01:35:37	iPhone	This is Carper He's a Tortellini Angiosperm In desperate need of a petting 11/10 would hug softly https://tco/lK9YDkRzPj	https://twitter.com/dog_rates/status/718613305783398402/photo/1	11.0	10	Carper	male		2016	April	04-09	Saturday	01:35
718540630683709445	2016-04-08 20:46:50	iPhone	Get you a pup that can do both 10/10 https://tco/zSbyvm62xZ	https://twitter.com/dog_rates/status/718540630683709445/photo/1,https://twitter.com/dog_rates/status/718540630683709445/photo/1	10.0	10		none		2016	April	04-08	Friday	20:46
718460005985447936	2016-04-08 15:26:28	iPhone	Meet Bowie He's listening for underground squirrels Smart af Left eye is considerably magical 9/10 would so pet https://tco/JyNmyjy3fe	https://twitter.com/dog_rates/status/718460005985447936/photo/1	9.0	10	Bowie	male		2016	April	04-08	Friday	15:26
718454725339934721	2016-04-08 15:05:29	iPhone	This pic is old but I hadn't seen it until today and had to share Creative af 13/10 very good boy would pet well https://tco/4kD16wMA1Z	https://twitter.com/dog_rates/status/718454725339934721/photo/1	13.0	10		none		2016	April	04-08	Friday	15:05
718246886998687744	2016-04-08 01:19:36	iPhone	This is Alexanderson He's got a weird ass birth mark Dreadful at fetch Won't eat kibble 3/10 wtf @Target https://tco/FmxOpf2Sgl	https://twitter.com/dog_rates/status/718246886998687744/photo/1	3.0	10	Alexanderson	male		2016	April	04-08	Friday	01:19
718234618122661888	2016-04-08 00:30:51	iPhone	This is Suki She was born with a blurry tail (unfortunate) Next level tongue tho 11/10 nifty hardwood https://tco/05S8oYztgb	https://twitter.com/dog_rates/status/718234618122661888/photo/1	11.0	10	Suki	female		2016	April	04-08	Friday	00:30
717841801130979328	2016-04-06 22:29:56	iPhone	This is Barclay His father was a banana 11/10 appeeling af https://tco/ucOEfr2rjV	https://twitter.com/dog_rates/status/717841801130979328/photo/1	11.0	10	Barclay	male		2016	April	04-06	Wednesday	22:29
717790033953034240	2016-04-06 19:04:14	iPhone	Here's a badass mystery pupper You weren't aware that you owe him money but you do 10/10 shades sick af https://tco/fv9e9AtzSG	https://twitter.com/dog_rates/status/717790033953034240/photo/1	10.0	10		male	pupper	2016	April	04-06	Wednesday	19:04
717537687239008257	2016-04-06 02:21:30	iPhone	People please This is a Deadly Mediterranean Plop T-Rex We only rate dogs Only send in dogs Thanks you 11/10 https://tco/2ATDsgHD4n	https://twitter.com/dog_rates/status/717537687239008257/photo/1	11.0	10		none		2016	April	04-06	Wednesday	02:21
717428917016076293	2016-04-05 19:09:17	Vine	This is Skittle He's trying to communicate 11/10 solid effort https://tco/6WTfJvtKx6	https://vine.co/v/iIhEU2lVqxz	11.0	10	Skittle	male		2016	April	04-05	Tuesday	19:09
717421804990701568	2016-04-05 18:41:02	iPhone	This is Ebby She's a Zimbabwean Feta Embarrassed by ridiculously squishy face 9/10 would squeeze softly https://tco/LBJqxMGaHi	https://twitter.com/dog_rates/status/717421804990701568/photo/1,https://twitter.com/dog_rates/status/717421804990701568/photo/1	9.0	10	Ebby	female		2016	April	04-05	Tuesday	18:41
717047459982213120	2016-04-04 17:53:31	iPhone	This is FlÃ¡vio (pronounced Baxter) He's a Benesnoop Cumberdog Super rare Symmetrical 12/10 would pet so well https://tco/fGgleFiBPq	https://twitter.com/dog_rates/status/717047459982213120/photo/1	12.0	10		male		2016	April	04-04	Monday	17:53
717009362452090881	2016-04-04 15:22:08	iPhone	This is Smokey He's having some sort of existential crisis 10/10 hang in there pupper https://tco/JmgF4dMpw0	https://twitter.com/dog_rates/status/717009362452090881/photo/1	10.0	10	Smokey	male	pupper	2016	April	04-04	Monday	15:22
716802964044845056	2016-04-04 01:41:58	iPhone	This is Link He struggles with couches 10/10 would assist https://tco/SbX4e6Yg3o	https://twitter.com/dog_rates/status/716802964044845056/photo/1,https://twitter.com/dog_rates/status/716802964044845056/photo/1	10.0	10	Link	male		2016	April	04-04	Monday	01:41
716791146589110272	2016-04-04 00:55:01	iPhone	Meet Jennifur She's supposed to be navigating Not even buckled up Insubordinate &amp; churlish 11/10 would still pet https://tco/h0trcJohYO	https://twitter.com/dog_rates/status/716791146589110272/photo/1	11.0	10	Jennifur	female		2016	April	04-04	Monday	00:55
716730379797970944	2016-04-03 20:53:33	iPhone	"There has clearly been a mistake Pup did nothing wrong 12/10 would help escape
https://tco/Juid3nnLbC"	https://twitter.com/chpsanfrancisco/status/716637124322177024	12.0	10		none		2016	April	04-03	Sunday	20:53
716447146686459905	2016-04-03 02:08:05	Vine	This is Ozzy He's acrobatic af Legendary pupper status achieved 13/10 https://tco/gHWsCTu90E	https://vine.co/v/eMmXVPn5eQK	13.0	10	Ozzy	male	pupper	2016	April	04-03	Sunday	02:08
716439118184652801	2016-04-03 01:36:11	iPhone	This is Bluebert He just saw that both #FinalFur match ups are split 50/50 Amazed af 11/10 https://tco/Kky1DPG4iq	https://twitter.com/dog_rates/status/716439118184652801/photo/1	11.0	10	Bluebert	male		2016	April	04-03	Sunday	01:36
716285507865542656	2016-04-02 15:25:47	iPhone	This is Stephanus She stays woke 12/10 https://tco/WIWabMngQZ	https://twitter.com/dog_rates/status/716285507865542656/photo/1,https://twitter.com/dog_rates/status/716285507865542656/photo/1	12.0	10	Stephanus	female		2016	April	04-02	Saturday	15:25
716080869887381504	2016-04-02 01:52:38	iPhone	Here's a super majestic doggo and a sunset 11/10 https://tco/UACnoyi8zu	https://twitter.com/dog_rates/status/716080869887381504/photo/1,https://twitter.com/dog_rates/status/716080869887381504/photo/1	11.0	10		none	doggo	2016	April	04-02	Saturday	01:52
715928423106027520	2016-04-01 15:46:52	iPhone	This is Bubbles He's a Yorkshire Piccolope 11/10 would snug aggressively https://tco/3BhMojONxq	https://twitter.com/dog_rates/status/715928423106027520/photo/1	11.0	10	Bubbles	male		2016	April	04-01	Friday	15:46
715758151270801409	2016-04-01 04:30:16	Vine	This is old now but it's absolutely heckin fantastic and I can't not share it with you all 13/10  https://tco/wJX74TSgzP	https://vine.co/v/hYdLVKDpAFu	13.0	10		none		2016	April	04-01	Friday	04:30
715733265223708672	2016-04-01 02:51:22	iPhone	This is a taco We only rate dogs Please only send in dogs Dogs are what we rate Not tacos Thank you 10/10 https://tco/cxl6xGY8B9	https://twitter.com/dog_rates/status/715733265223708672/photo/1	10.0	10		none		2016	April	04-01	Friday	02:51
715704790270025728	2016-04-01 00:58:13	Vine	This is Bentley He gives kisses back 11/10 precious af (vid by @emmaallen25) https://tco/9PnKkKzoUp	https://vine.co/v/ijAlDnuOD0l	11.0	10	Bentley	male		2016	April	04-01	Friday	00:58
715696743237730304	2016-04-01 00:26:15	iPhone	Meet Toby He's a Lithuanian High-Steppin Stickeroo One of the more accomplished Stickeroos around 10/10 so nifty https://tco/cYPHuJYTjC	https://twitter.com/dog_rates/status/715696743237730304/photo/1	10.0	10	Toby	male		2016	April	04-01	Friday	00:26
715680795826982913	2016-03-31 23:22:53	iPhone	This is Zeus He's downright fabulous 12/10 https://tco/sSugyyRuTp	https://twitter.com/dog_rates/status/715680795826982913/photo/1,https://twitter.com/dog_rates/status/715680795826982913/photo/1,https://twitter.com/dog_rates/status/715680795826982913/photo/1	12.0	10	Zeus	male		2016	March	03-31	Thursday	23:22
715360349751484417	2016-03-31 02:09:32	iPhone	This is Bertson He just wants to say hi 11/10 would boop nose https://tco/hwv7Wq6gDA	https://twitter.com/dog_rates/status/715360349751484417/photo/1	11.0	10	Bertson	male		2016	March	03-31	Thursday	02:09
715342466308784130	2016-03-31 00:58:29	iPhone	This is Oscar He's a world renowned snowball inspector It's a ruff job but someone has to do it 10/10 great guy https://tco/vSufMAKm3C	https://twitter.com/dog_rates/status/715342466308784130/photo/1,https://twitter.com/dog_rates/status/715342466308784130/photo/1	10.0	10	Oscar	male		2016	March	03-31	Thursday	00:58
715220193576927233	2016-03-30 16:52:36	iPhone	This is Nico His selfie game is strong af Excellent use of a sneaky tongue slip 10/10 star material https://tco/1OBdJkMOFx	https://twitter.com/dog_rates/status/715220193576927233/photo/1	10.0	10	Nico	male		2016	March	03-30	Wednesday	16:52
715200624753819648	2016-03-30 15:34:51	iPhone	This is Michelangelope He's half coffee cup Rare af 12/10 would hug until someone stopped me https://tco/tvVDY0G911	https://twitter.com/dog_rates/status/715200624753819648/photo/1	12.0	10	Michelangelop	male		2016	March	03-30	Wednesday	15:34
715009755312439296	2016-03-30 02:56:24	iPhone	This is Siba She's remarkably mobile Very sleepy as well 12/10 would happily transport https://tco/TjnI33RE1i	https://twitter.com/dog_rates/status/715009755312439296/photo/1	12.0	10	Siba	female		2016	March	03-30	Wednesday	02:56
714982300363173890	2016-03-30 01:07:18	iPhone	This is Calbert He forgot to clear his Google search history 9/10 rookie mistake Calbert https://tco/jRm5J3YCmj	https://twitter.com/dog_rates/status/714982300363173890/photo/1	9.0	10	Calbert	male		2016	March	03-30	Wednesday	01:07
714962719905021952	2016-03-29 23:49:30	Vine	Just in case anyone's having a bad day 12/10 would bounce with https://tco/T9sgP9ttnQ	https://vine.co/v/inVtemLt9tE	12.0	10		none		2016	March	03-29	Tuesday	23:49
714957620017307648	2016-03-29 23:29:14	iPhone	This is Curtis He's an Albino Haberdasher Terrified of dandelions They really spook him up 10/10 it'll be ok pup https://tco/s8YcfZrWhK	https://twitter.com/dog_rates/status/714957620017307648/photo/1	10.0	10	Curtis	male		2016	March	03-29	Tuesday	23:29
714631576617938945	2016-03-29 01:53:39	iPhone	This is Benedict He's a feisty pup Needs a brushing Portable af Looks very angry actually 4/10 might not pet https://tco/3oeFfHjv0Z	https://twitter.com/dog_rates/status/714631576617938945/photo/1	4.0	10	Benedict	male		2016	March	03-29	Tuesday	01:53
714606013974974464	2016-03-29 00:12:05	iPhone	Here are two lil cuddly puppers Both 12/10 would snug like so much https://tco/zO4eb7C4tG	https://twitter.com/dog_rates/status/714606013974974464/photo/1	12.0	10		none	pupper	2016	March	03-29	Tuesday	00:12
714485234495041536	2016-03-28 16:12:09	Vine	This is Blitz He screams 10/10 (vid by @yeaahliv) https://tco/MfW2aym5UF	https://vine.co/v/iDrOvVqq0A6	10.0	10	Blitz	male		2016	March	03-28	Monday	16:12
714258258790387713	2016-03-28 01:10:13	iPhone	"Meet Travis and Flurp Travis is pretty chill but Flurp can't lie down properly 10/10 &amp; 8/10
get it together Flurp https://tco/Akzl5ynMmE"	https://twitter.com/dog_rates/status/714258258790387713/photo/1	10.0	10	Travis	none		2016	March	03-28	Monday	01:10
714251586676113411	2016-03-28 00:43:43	iPhone	This is Thumas He hates potted plants 8/10 wtf Thumas https://tco/rDVueNIcEi	https://twitter.com/dog_rates/status/714251586676113411/photo/1,https://twitter.com/dog_rates/status/714251586676113411/photo/1	8.0	10	Thumas	male		2016	March	03-28	Monday	00:43
714214115368108032	2016-03-27 22:14:49	iPhone	Happy Easter from the squad! ðŸ‡ðŸ¶ 13/10 for all https://tco/YMx4KWJUAB	https://twitter.com/dog_rates/status/714214115368108032/photo/1	13.0	10		none		2016	March	03-27	Sunday	22:14
714141408463036416	2016-03-27 17:25:54	iPhone	I know we only rate dogs but since it's Easter I guess we could rate a bunny for a change 10/10 petable as hell https://tco/O2RlKXigHu	https://twitter.com/dog_rates/status/714141408463036416/photo/1	10.0	10		none		2016	March	03-27	Sunday	17:25
713919462244790272	2016-03-27 02:43:58	iPhone	This is Kanu He's a Freckled Ticonderoga Simply flawless 12/10 would perform an elaborate heist to capture https://tco/7vyAzIURrE	https://twitter.com/dog_rates/status/713919462244790272/photo/1	12.0	10	Kanu	male		2016	March	03-27	Sunday	02:43
713909862279876608	2016-03-27 02:05:49	Vine	This is Doug His nose is legendary af 12/10 (vid by @probably_trey) https://tco/7IWKfbfihS	https://vine.co/v/iDWlapaXWmm	12.0	10	Doug	male		2016	March	03-27	Sunday	02:05
713900603437621249	2016-03-27 01:29:02	iPhone	Happy Saturday here's 9 puppers on a bench 99/90 good work everybody https://tco/mpvaVxKmc1	https://twitter.com/dog_rates/status/713900603437621249/photo/1	11.0	10		none	pupper	2016	March	03-27	Sunday	01:29
713761197720473600	2016-03-26 16:15:05	iPhone	This is Piper She would really like that tennis ball core Super sneaky tongue slip 12/10 precious af https://tco/QP6GHi5az9	https://twitter.com/dog_rates/status/713761197720473600/photo/1,https://twitter.com/dog_rates/status/713761197720473600/photo/1	12.0	10	Piper	female		2016	March	03-26	Saturday	16:15
713411074226274305	2016-03-25 17:03:49	iPhone	Here we see an extremely rare Bearded Floofmallow Only a few left in the wild 11/10 would pet with a purpose https://tco/jVJJKlPbvq	https://twitter.com/dog_rates/status/713411074226274305/photo/1	11.0	10		none		2016	March	03-25	Friday	17:03
713177543487135744	2016-03-25 01:35:51	iPhone	This is Lance Lance doesn't give a shit 10/10 we should all be more like Lance https://tco/SqnG9Ap28J	https://twitter.com/dog_rates/status/713177543487135744/photo/1	10.0	10	Lance	none		2016	March	03-25	Friday	01:35
713175907180089344	2016-03-25 01:29:21	iPhone	Say hello to Opie and Clarkus Clarkus fell asleep so Opie buried him Ruthless af 10/10 for both https://tco/xT7XaY4gnW	https://twitter.com/dog_rates/status/713175907180089344/photo/1	10.0	10	Opie	male		2016	March	03-25	Friday	01:29
712809025985978368	2016-03-24 01:11:29	iPhone	This is Stubert He just arrived 10/10 https://tco/HVGs5aAKAn	https://twitter.com/dog_rates/status/712809025985978368/photo/1	10.0	10	Stubert	male		2016	March	03-24	Thursday	01:11
712717840512598017	2016-03-23 19:09:09	iPhone	Please don't send in any more polar bears We only rate dogs Thank you 10/10 https://tco/83RGhdIQz2	https://twitter.com/dog_rates/status/712717840512598017/photo/1	10.0	10		none		2016	March	03-23	Wednesday	19:09
712668654853337088	2016-03-23 15:53:42	iPhone	Say hello to Sunny and Roxy They pull things out of water together 10/10 for both https://tco/88aedAmxcl	https://twitter.com/dog_rates/status/712668654853337088/photo/1,https://twitter.com/dog_rates/status/712668654853337088/photo/1,https://twitter.com/dog_rates/status/712668654853337088/photo/1	10.0	10	Sunny	none		2016	March	03-23	Wednesday	15:53
712438159032893441	2016-03-23 00:37:48	iPhone	This is Kane He's a semi-submerged Haitian Huffleplop Happy af Sick waterfall 11/10 would pat head approvingly https://tco/7zjEC501Ul	https://twitter.com/dog_rates/status/712438159032893441/photo/1	11.0	10	Kane	male		2016	March	03-23	Wednesday	00:37
712309440758808576	2016-03-22 16:06:19	iPhone	"Reminder that we made our first set of stickers available! All are 12/10 would stick
Use code ""pupper"" at checkoutðŸ¶

https://tco/kJIMNyMNKV"	https://twitter.com/stickergrub/status/709919141004595201	12.0	10		none	pupper	2016	March	03-22	Tuesday	16:06
712097430750289920	2016-03-22 02:03:52	iPhone	I can't even comprehend how confused this dog must be right now 10/10 https://tco/8AGcQ4hIfK	https://twitter.com/dog_rates/status/712097430750289920/photo/1	10.0	10		none		2016	March	03-22	Tuesday	02:03
712092745624633345	2016-03-22 01:45:15	iPhone	This is Steven He's inverted af Also very helpful Scans anything you want for free Takes him a while tho 7/10 https://tco/tA0ZiQ7JcG	https://twitter.com/dog_rates/status/712092745624633345/photo/1	7.0	10	Steven	male		2016	March	03-22	Tuesday	01:45
712085617388212225	2016-03-22 01:16:55	iPhone	"Say hello to Olive and Ruby They are best buddies Both 11/10 
1 like = 1 buddy https://tco/yagmFdKlyL"	https://twitter.com/dog_rates/status/712085617388212225/photo/1,https://twitter.com/dog_rates/status/712085617388212225/photo/1,https://twitter.com/dog_rates/status/712085617388212225/photo/1	11.0	10	Olive	none		2016	March	03-22	Tuesday	01:16
712065007010385924	2016-03-21 23:55:01	iPhone	This is Chester He's clearly in charge of the other dogs Weird ass paws Not fit for fetch 6/10 would still pet https://tco/o2GvskrhHt	https://twitter.com/dog_rates/status/712065007010385924/photo/1	6.0	10	Chester	male		2016	March	03-21	Monday	23:55
711968124745228288	2016-03-21 17:30:03	iPhone	Meet Winston He's trapped in a cup of coffee Poor pupper 10/10 someone free him https://tco/2e6cUtKUuc	https://twitter.com/dog_rates/status/711968124745228288/photo/1	10.0	10	Winston	male	pupper	2016	March	03-21	Monday	17:30
711743778164514816	2016-03-21 02:38:34	iPhone	Meet Roosevelt He's calculating the best case scenario if he drops out instead of doing math hw 11/10 relatable af https://tco/QcSIRDpfVg	https://twitter.com/dog_rates/status/711743778164514816/photo/1	11.0	10	Roosevelt	male		2016	March	03-21	Monday	02:38
711732680602345472	2016-03-21 01:54:29	iPhone	I want to hear the joke this dog was just told 10/10 https://tco/1KiuZqqOD4	https://twitter.com/dog_rates/status/711732680602345472/photo/1,https://twitter.com/dog_rates/status/711732680602345472/photo/1,https://twitter.com/dog_rates/status/711732680602345472/photo/1	10.0	10		none		2016	March	03-21	Monday	01:54
711694788429553666	2016-03-20 23:23:54	iPhone	Oh My God 13/10 magical af https://tco/Ezu6jQrKAZ	https://twitter.com/dog_rates/status/711694788429553666/photo/1	13.0	10		none		2016	March	03-20	Sunday	23:23
711652651650457602	2016-03-20 20:36:28	iPhone	This is Gary He just wanted to say hi 9/10 very personable pup https://tco/Sk3CbhmKSW	https://twitter.com/dog_rates/status/711652651650457602/photo/1	9.0	10	Gary	male		2016	March	03-20	Sunday	20:36
711363825979756544	2016-03-20 01:28:47	iPhone	"""Please no puparazzi"" 11/10 https://tco/nJIXSPfedK"	https://twitter.com/dog_rates/status/711363825979756544/photo/1,https://twitter.com/dog_rates/status/711363825979756544/photo/1	11.0	10		none		2016	March	03-20	Sunday	01:28
711306686208872448	2016-03-19 21:41:44	iPhone	What hooligan sent in pictures w/out a dog in them? Churlish af 3/10 just bc that's a neat fluffy bean bag chair https://tco/wcwoGOkZvz	https://twitter.com/dog_rates/status/711306686208872448/photo/1,https://twitter.com/dog_rates/status/711306686208872448/photo/1	3.0	10		none		2016	March	03-19	Saturday	21:41
711008018775851008	2016-03-19 01:54:56	iPhone	This is Chuckles He had a balloon but he accidentally let go of it and it floated away 11/10 hang in there pupper https://tco/68iNM7B5gW	https://twitter.com/dog_rates/status/711008018775851008/photo/1	11.0	10	Chuckles	male	pupper	2016	March	03-19	Saturday	01:54
710997087345876993	2016-03-19 01:11:29	iPhone	Meet Milo and Amos They are the best of pals Both 12/10 would pet at the same time https://tco/Mv37BHEyyD	https://twitter.com/dog_rates/status/710997087345876993/photo/1	12.0	10	Milo	none		2016	March	03-19	Saturday	01:11
710844581445812225	2016-03-18 15:05:29	iPhone	This is Staniel His selfie game is strong af 10/10 I'd snapchat with Staniel https://tco/UgkTw7TKyM	https://twitter.com/dog_rates/status/710844581445812225/photo/1	10.0	10	Staniel	male		2016	March	03-18	Friday	15:05
